{
  "repository": "openai/openai-assistants-quickstart",
  "commit": "06fc2d444a5d41b574082080f4c7b2e48156b84f",
  "language": "typescript",
  "local_path": "benchmark/checkouts/openai-assistants-quickstart",
  "notes": [
    "Curated 2026-10-18 by reading every source file before running the scanner.",
    "AI packages follow the project's documented allowlist (collectors/dependencies.py).",
    "The function tool get_weather is a schema-only definition; tools are not scored.",
    "The thread message (threads.messages.create, role user) carries request content",
    "to the model and is expected as a prompt even though that SDK call is not a",
    "modeled sink; it is a known false negative, kept on purpose."
  ],
  "components": [
    {
      "type": "ai_package",
      "name": "openai",
      "file": "package.json",
      "line": 13,
      "status": "declared"
    },
    {
      "type": "service",
      "name": "openai",
      "file": "app/openai.ts",
      "status": "instantiated"
    },
    {
      "type": "model",
      "name": "gpt-4o",
      "file": "app/api/assistants/route.ts",
      "line": 10,
      "status": "invoked"
    },
    {
      "type": "prompt",
      "name": "system-prompt@app/api/assistants/route.ts:8",
      "file": "app/api/assistants/route.ts",
      "status": "invoked"
    },
    {
      "type": "prompt",
      "name": "user-prompt@app/api/assistants/threads/[threadId]/messages/route.ts:10",
      "file": "app/api/assistants/threads/[threadId]/messages/route.ts",
      "status": "invoked"
    }
  ]
}
